<?xml version="1.0" encoding="UTF-8"?>
<Pravni_akt xmlns="aktovi"
    xmlns:xsi="http://www.w3.org/2001/XMLSchema-instance"
    xsi:schemaLocation="aktovi file:/C:/Users/Dorian/Desktop/Faks/Cetvrta_godina/XML%20i%20Web%20servisi/git_proj/XMLProjekat/XML-Projekat/src/main/schema/akt.xsd">
    <Stanje></Stanje>
    <Naziv>Z A K O N
        O POLICIJI</Naziv>
    <Glavni_deo>
        
        <Glava Id="1" Naziv="OSNOVNE ODREDBE">
            
            <Clan Broj_clana="1" Naziv="Predmet zakona">
                <Stav Id="1" >
                    Ovim zakonom uređuju se unutrašnji poslovi, organizacija i
                    nadležnost Ministarstva unutrašnjih poslova (u daljem tekstu:
                    Ministarstvo), policijski poslovi, organizacija i nadležnost Policije, kao i
                    druga pitanja od značaja za rad Policije i Ministarstva.
                </Stav>
            </Clan>
            
            <Clan Broj_clana="2" Naziv="Pojam unutrašnjih poslova">
                <Stav Id="1">
                    Unutrašnji poslovi su zakonom utvrđeni poslovi državne uprave, koje
                    obavlja Ministarstvo, a čijim obavljanjem se ostvaruje i unapređuje
                    bezbednost građana i imovine, pruža podrška vladavini prava i obezbeđuje
                    ostvarivanje Ustavom i zakonom utvrđenih ljudskih i manjinskih prava i
                    sloboda, kao i drugi, sa njima povezani poslovi iz utvrđenog delokruga i
                    nadležnosti Ministarstva.
                </Stav>
            </Clan>
            
            <Clan Broj_clana="3" Naziv="Policija">
                <Stav Id="1">
                    Policija je centralna organizaciona jedinica Ministarstva koja u
                    obavljanju unutrašnjih odnosno policijskih poslova, štiti i unapređuje
                    bezbednost građana i imovine, poštujući Ustavom zajemčena ljudska i
                    manjinska prava i slobode i druge zaštićene vrednosti u demokratskom
                    društvu, uz mogućnost na Ustavu i zakonu zasnovane upotrebe sredstava
                    prinude.
                </Stav>
            </Clan>
            
            <Clan Broj_clana="4">
                <Stav Id="1">
                    Ministar unutrašnjih poslova (u daljem tekstu: ministar) u okviru
                    odredbi ovog zakona, propisuje način obavljanja unutrašnjih poslova.
                </Stav>
            </Clan>
            
            <Clan Broj_clana="5" Naziv="Informisanje o radu Ministarstva">
                <Stav Id="1">Rad Ministarstva je javan.</Stav>
                <Stav Id="2">
                    Ministarstvo redovno blagovremeno i potpuno obaveštava javnost o
                    svom radu, osim u slučajevima preduzimanja mera i radnji u skladu sa zakonom
                    kojim se uređuje krivični postupak i kada bi to onemogućilo neometan
                    operativni rad Policije, ili ako bi se time:
                    <Tacka broj="1">povredio propis o tajnosti podataka;</Tacka>
                    <Tacka broj="2">povredilo dostojanstvo građana;</Tacka>
                    <Tacka broj="3">ugrozilo pravo na ličnu slobodu i bezbednost.</Tacka>
                </Stav>
                <Stav Id="3">
                    Ministarstvo jednom godišnje, a najkasnije u roku od tri meseca od
                    završetka kalendarske godine, objavljuje:
                    <Tacka broj="1">
                        izveštaj o stanju bezbednosti u Republici Srbiji koji na
                        transparentan i javan način obaveštava javnost o proceni bezbednosti,
                        trendovima kretanja kriminala i drugih bezbednosnih pojava od značaja za
                        bezbednost i prava građana;
                    </Tacka>
                    <Tacka broj="2">
                        izveštaj o radu Ministarstva, koji na transparentan i javan način
                        obaveštava javnost o razvoju policije, statističkim podacima o sprovedenim
                        aktivnostima i postignutim rezultatima.
                    </Tacka>
                    
                    Pored izveštaja iz <Referenca ref_stav="3">stava 3.</Referenca> ovog člana, Ministarstvo je u obavezi da
                    objavi na svojoj internet prezentaciji i tromesečne informacije o radu, koje
                    usvaja nadležni odbor Narodne skupštine Republike Srbije za unutrašnje
                    poslove.
                </Stav>
            </Clan>
            
        </Glava>
        
        <Glava Id="2" Naziv="SARADNjA MINISTARSTVA">
            
            <Clan Broj_clana="6" Naziv="Saradnja sa službama bezbednosti">
                <Stav Id="1">
                    Ministarstvo neposredno sarađuje sa službama bezbednosti u
                    Republici Srbiji kroz razmenu informacija i tehničku saradnju, u skladu sa
                    zakonom.
                </Stav>
                <Stav Id="2">
                    Saradnja iz <Referenca ref_clan="3" ref_stav="1">stava 1. člana 3.</Referenca> zasniva se na pravima i dužnostima
                    utvrđenim Ustavom, zakonom, drugim propisima i opštim aktima i na
                    posebnim oblicima organizovanja i uzajamnog obaveštavanja u izvršavanju
                    zajedničkih zadataka.
                </Stav>
            </Clan>
            
            <Clan Broj_clana="7">
                <Stav Id="1">
                    Organizacione jedinice u sedištu Direkcije policije, Policijska
                    uprava za Grad Beograd i policijske uprave obrazuju se tako da su radno i
                    funkcionalno povezane sa odgovarajućim organizacionim jedinicama i
                    poslovima na način da srodne policijske poslove iz svog delokruga obavljaju
                    na centralnom, regionalnom i lokalnom nivou.
                </Stav>
                <Stav Id="2">
                    Direkcijom policije rukovodi direktor policije.
                </Stav>
                <Stav Id="3">
                    Rukovođenje i odgovornost u Direkciji policije zasniva se na načelu
                    jednostarešinstva i subordinacije.
                </Stav>
                <Stav Id="4">
                    Specijalna i posebne jedinice policije angažuju se odlukom
                    rukovodioca odgovarajuće organizacione jedinice.
                </Stav>
                <Stav Id="5">
                    Za angažovanje Žandarmerije, rukovodilac organizacione jedinice
                    pribavlja prethodno odobrenje direktora policije.
                </Stav>
                <Stav Id="6">
                    Izuzetno od <Referenca ref_stav="1" ref_clan="3">st. 1 člana 3.</Referenca>, Specijalna antiteroristička
                    jedinica, Helikopterska jedinica i Žandarmerija prilikom angažovanja koje
                    obuhvata upotrebu jednog ili više odreda u maksimalnom kapacitetu, angažuju
                    se odlukom rukovodioca odgovarajuće organizacione jedinice uz prethodno
                    pribavljeno odobrenje direktora policije i prethodno pribavljenu
                    saglasnost ministra.
                </Stav>
            </Clan>
            
        </Glava>
        
    </Glavni_deo>
    <Drzava>Republika Srbija</Drzava>
    <Pokrajina>Autonomna pokrajina Vojvodina</Pokrajina>
    <Grad>Grad Novi Sad</Grad>
    <Skupstina>Skupstina grada Novog Sada</Skupstina>
    <Broj_popisa_kod_organa>6541282168421554</Broj_popisa_kod_organa>
    <Datum_donosenja_propisa>17.06.2016</Datum_donosenja_propisa>
    <Mesto_donosenja_propisa>Novi Sad</Mesto_donosenja_propisa>
    <Ovlasceno_lice>
        <Titula>Predsednik</Titula>
        <Ime>Zoran</Ime>
        <Prezime>Cogic</Prezime>
    </Ovlasceno_lice>
    <Timestamp>2002-05-30T09:00:00</Timestamp>
</Pravni_akt>